"stabilisateur","stabilisateur","évite les fluctuation en pression ou en débit"
"reducteur","réducteur","réduit la pression ou le débit"
"limiteur","limiteur de débit","maintient automatiquement le débit, indépendamment des changements de pressions amont ou aval."
"vanne_alti","vanne altimétrique","vanne de régulation - régule automatiquement les niveaux d'eau"
"non_renseigne","Non renseigné(e)","information en recherche ou disponible mais non saisie"
"non_concerne","Non concerné(e)","information non possible ou non pertinente pour l'élément décrit"
"non_valide","Non validé(e)","information existe mais n'est pas officiellement validée"
"non_determine","Non déterminé(e)","information inconnue ou non disponible et ne peut pas l'être"
"autre","Autre","ne figure pas dans la liste ci-dessus. cf. commentaire"
