"eau_brute","Eau brute","eau non traitée pour potabilisation"
"eau_potable","Eau potable","eau potable conforme pour distribution"
"eau_industriellle","Eau industrielle","eau industrielle avec un traitement spécifique"
"non_renseigne","Non renseigné(e)","information en recherche ou disponible mais non saisie"
"non_concerne","Non concerné(e)","information non possible ou non pertinente pour l'élément décrit"
"non_valide","Non validé(e)","information existe mais n'est pas officiellement validée"
"non_determine","Non déterminé(e)","information inconnue ou non disponible et ne peut pas l'être"
"autre","Autre","ne figure pas dans la liste ci-dessus. cf. observations"
