"infiltration","infiltration","non étanche - les eaux s'infiltrent dans le terrain"
"retention","rétention","permet le stockage temporaire des eaux (transit)"
"stockage","stockage","permet le stockage des eaux sur une durée longue dans l'attente de leur évacuation"
"retention_infiltration","infiltration + rétention","permet le stockage dans l'attente de l'évacuation par infiltration"
"non_renseigne","Non renseigné(e)","information en recherche ou disponible mais non saisie"
"non_concerne","Non concerné(e)","information non possible ou non pertinente pour l'élément décrit"
"non_valide","Non validé(e)","information existe mais n'est pas officiellement validée"
"non_determine","Non déterminé(e)","information inconnue ou non disponible et ne peut pas l'être"
"autre","Autre","ne figure pas dans la liste ci-dessus. cf. observations"
