"creation","création","pose d'éléments neufs où il n'en existaient pas (extension réseau, création ouvrage neuf...)"
"renouvellement","renouvellement","ou remplacement. pose d'un élément en lieu et place d'un ancien élément alors abandonné"
"rehab_structurante","réhabilitation structurante","remise en état d'un élément existant sans dépose de celui-ci"
"rehab_ponctuelle","réhabilitation ponctuelle","remise en état d'un élément existant sans dépose de celui-ci"
"non_renseigne","non renseigné(e)","information en recherche ou disponible mais non saisie"
"non_concerne","non concerné(e)","information non possible ou non pertinente pour l'élément décrit"
"non_valide","non validé(e)","information existe mais n'est pas officiellement validée"
"non_determine","non déterminé(e)","information inconnue ou non disponible et ne peut pas l'être"
"autre","autre","ne figure pas dans la liste ci-dessus. cf. commentaire"
