"refoulement","refoulement","relève et transporte les eaux à une distance importante via une canalisation"
"relevement","relèvement","relève le niveau des eaux, sans distance importante vers la destination"
"en_ligne","pompage en ligne","permet de d’accélérer ou d'injecter des eaux dans le réseau"
"sous_vide","sous vide","pompe à vide"
"non_renseigne","non renseigné(e)","information en recherche ou disponible mais non saisie"
"non_concerne","non concerné(e)","information non possible ou non pertinente pour l'élément décrit"
"non_valide","non validé(e)","information existe mais n'est pas officiellement validée"
"non_determine","non déterminé(e)","information inconnue ou non disponible et ne peut pas l'être"
"autre","autre","ne figure pas dans la liste ci-dessus. cf. commentaire"
