"domestique","domestique","branchement d'un habitat particulier ou d'un habitat collectif"
"industriel","industriel","eaux issues d'un bâtiment industriel (usine...)"
"commercial","commercial","eaux issues d'un bâtiment essentiellement commercial (Supermarché...)"
"tertiaire","tertiaire","eaux issues d'un bâtiment d'activité essentiellement tertiaire (bureaux...)"
"medical","medical","eaux issues d'une unité médicale ou paramédicale (hopital,  centre dialyse...)"
"mixte","mixte","branchement rejettant plusieurs d'eaux"