"direct","Boite à passage direct","Le passage de l'effluent s'effectue en ligne droite depuis l'amont jusqu'à l'aval de la boîte de branchement"
"siphon","Boite siphoïde","boite fait office de siphon anti-odeur et fait obstacle aux corps flottants"
"disconnecteur","disconnecteur","assure la décantation ou la rétention des matières lourdes ou légères, et des corps volumineux"
"te","Té","té de visite"
"borgne","Borgne","boite ou point sans accès de surface"
"etanche","étanche","boite point étanche à l'eau et à l'air"