"gs","génératrice superieure","ligne fictive qui marque le point le plus élevé d’une canalisation ou d’un ouvrage"
"gi","génératrice inférieure","ligne fictive qui marque le point le plus bas d’une canalisation ou d’un ouvrage"
"fe","fil d'eau","la partie la plus basse de l’intérieur d’une canalisation ou d'un ouvrage"
"voute","voute","voute intérieure ou intrados"
"topo","topographique","mesure du détail des formes d'un terrain"
"radier","radier","radier"
"fouille","fond de fouille","fond de fouille"